{"archive":{"bytes":14526,"commit":"acdb41904a13425ae3c638f3658c1955b7998032","path":"archives/single-cell-enrichment-bar-pathway-genes/1.0.0/single-cell-enrichment-bar-pathway-genes-1.0.0.zip","repository":"jarxunlai/ScientificFigureLibrary-community-archives","sha256":"6b9700a92dde1625178f33c118b9d0fec60c6e6c7ed2628901b23af1a47790e2"},"contentDigest":"462f2060f13e7a2564b2eb74ad62a71a4b05ae33c87d848ee3f44f864450e793","description":"A clean-room, two-panel enrichment overview built from a neutral synthetic long table.","licenses":{"code":"MIT","content":"CC-BY-4.0","documentation":"CC-BY-4.0"},"preview":{"bytes":540780,"canonicalRgbaSha256":"93515e6bc32e297e01515dd4584b95d259595cfaec8bb39826e82a325b4cfb6f","height":600,"mediaType":"image/png","path":"thumbs/single-cell-enrichment-bar-pathway-genes/1.0.0.png","sha256":"93e6d36b8ad5ab10b4e2fbb65612d9d85a09bc56e3476f69fcf4267a8c0dc84a","width":900},"provenance":[{"type":"note","value":"Clean-room authored code, neutral synthetic data, and code-generated preview."}],"providerId":"io.github.jarxunlai.scientific-figure-community","releaseVersion":"1.0.0","schema":"figure-library.public-template-entry.v1","search":{"application":"A clean-room, two-panel enrichment overview built from a neutral synthetic long table.","codeFiles":["payload/code/render.R"],"dataProfile":"Synthetic data: enrichment.csv","inputFiles":["payload/data/enrichment.csv"],"language":"R","packages":[],"plotFamily":"bar","tags":["bar chart","enrichment","genes","pathway"]},"status":{"curationStatus":"curated","localReviewStatus":"not_reviewed","plotExecutionByRecipient":"not_run","publisherVerified":false,"renderValidation":"ci_rendered","upstreamStatus":"published"},"templateId":"single-cell-enrichment-bar-pathway-genes","title":"Enrichment bar chart with pathway genes"}
