{"archive":{"bytes":23390,"commit":"30d45429419f68166cb9cfa3310dc8c03b2f1e72","path":"archives/umap-unchull-main-type-circles/1.0.0/umap-unchull-main-type-circles-1.0.0.zip","repository":"jarxunlai/ScientificFigureLibrary-community-archives","sha256":"2a0ae1426d6ecf16ba1bb8087187490f4f95aafcc55edab41ed77cacb72a6387"},"contentDigest":"9a574ded8aa993fbf99352acf9e654a84572c3262cf2935415dbb621f3669239","description":"A clean-room abstract embedding with fixed-seed synthetic points and data-derived major-type circles.","licenses":{"code":"MIT","content":"CC-BY-4.0","documentation":"CC-BY-4.0"},"preview":{"bytes":540780,"canonicalRgbaSha256":"be0edde5eca2fc8db07e3226ef7a7eca653637063d727e1ef54f848a075ead13","height":600,"mediaType":"image/png","path":"thumbs/umap-unchull-main-type-circles/1.0.0.png","sha256":"a19eafa36a6304a5397c4085249136815c35015de4420e06e633c59a85875a05","width":900},"provenance":[{"type":"note","value":"Clean-room authored code, neutral synthetic data, and code-generated preview."}],"providerId":"io.github.jarxunlai.scientific-figure-community","releaseVersion":"1.0.0","schema":"figure-library.public-template-entry.v1","search":{"application":"A clean-room abstract embedding with fixed-seed synthetic points and data-derived major-type circles.","codeFiles":["payload/code/render.R"],"dataProfile":"Synthetic data: embedding.csv","inputFiles":["payload/data/embedding.csv"],"language":"R","packages":[],"plotFamily":"scatter","tags":["circles","clusters","embedding","scatter"]},"status":{"curationStatus":"curated","localReviewStatus":"not_reviewed","plotExecutionByRecipient":"not_run","publisherVerified":false,"renderValidation":"ci_rendered","upstreamStatus":"published"},"templateId":"umap-unchull-main-type-circles","title":"Embedding clusters with major-type circles"}
