{"archive":{"bytes":17193,"commit":"0d535e42c5abb1114f90ad10439d0d505138eb39","path":"archives/ggsankeyfier-layout-color-combo/1.0.0/ggsankeyfier-layout-color-combo-1.0.0.zip","repository":"jarxunlai/ScientificFigureLibrary-community-archives","sha256":"5f747193750083c7abd4c3aa8ebdc7ab65a1d6d647aa349976855f056351d94a"},"contentDigest":"0c1acb2c62e54c82963332f52e7934c90781c59b85778f20924f7affcc54cdec","description":"A clean-room Sankey-style template with synthetic three-stage flows and a portable palette.","licenses":{"code":"MIT","content":"CC-BY-4.0","documentation":"CC-BY-4.0"},"preview":{"bytes":540780,"canonicalRgbaSha256":"f4ad594c321baa4a17a381d5e02f633b333758b32822735f99fa20be56d45019","height":600,"mediaType":"image/png","path":"thumbs/ggsankeyfier-layout-color-combo/1.0.0.png","sha256":"b2c5dcbf798ca5a5f8b796b17a7b1ee283a3f1c338ddb68ecbad18c4c6250aad","width":900},"provenance":[{"type":"note","value":"Clean-room authored code, neutral synthetic data, and code-generated preview."}],"providerId":"io.github.jarxunlai.scientific-figure-community","releaseVersion":"1.0.0","schema":"figure-library.public-template-entry.v1","search":{"application":"A clean-room Sankey-style template with synthetic three-stage flows and a portable palette.","codeFiles":["payload/code/render.R"],"dataProfile":"Synthetic data: flows.csv","inputFiles":["payload/data/flows.csv"],"language":"R","packages":[],"plotFamily":"sankey","tags":["alluvial","flow","layout","sankey"]},"status":{"curationStatus":"curated","localReviewStatus":"not_reviewed","plotExecutionByRecipient":"not_run","publisherVerified":false,"renderValidation":"ci_rendered","upstreamStatus":"published"},"templateId":"ggsankeyfier-layout-color-combo","title":"Portable multi-stage Sankey layout"}
